{
  "schema_version": "0.1",
  "source": {
    "clusters_path": "data\\acceptance\\frozen-20260910\\full-chain\\m04\\clusters.json",
    "clusters_sha256": "31f6ec894017f28331817a87633c5d1ebdd5fc9c659d1c8f7ff048115326c03f",
    "framing_path": "data\\acceptance\\frozen-20260910\\full-chain\\m03\\framing.json",
    "framing_sha256": "3f7796ccb23bbd329f1308864fdd797d4165406e62226b9a77e0ccb55102c645",
    "stream_id": "download-01-d8f9c37a5714-tcp-0-node1_to_node0-38c0c8258fcb",
    "message_count": 3
  },
  "status": "ok",
  "parameters": {
    "algorithm": "needleman_wunsch_reference",
    "match_score": 2,
    "mismatch_score": -1,
    "gap_score": -2,
    "max_pair_cells": 2000000
  },
  "cluster_alignments": [],
  "unaligned_messages": [
    {
      "message_id": "download-01-d8f9c37a5714-tcp-0-node1_to_node0-38c0c8258fcb-message-000000",
      "reason": "m04_noise"
    },
    {
      "message_id": "download-01-d8f9c37a5714-tcp-0-node1_to_node0-38c0c8258fcb-message-000001",
      "reason": "m04_noise"
    },
    {
      "message_id": "download-01-d8f9c37a5714-tcp-0-node1_to_node0-38c0c8258fcb-message-000002",
      "reason": "m04_noise"
    }
  ],
  "metrics": {
    "aligned_cluster_count": 0,
    "aligned_message_count": 0,
    "unaligned_message_count": 3,
    "total_alignment_columns": 0,
    "mean_identity_on_paired_bytes": null
  },
  "warnings": [
    "Alignment columns are relative to each M04 representative, not a globally optimal multiple alignment.",
    "Stable columns and high identity do not by themselves establish field semantics."
  ]
}
